{
  "skill": "find_skills",
  "input": {
    "query": "segment a CT NIfTI volume"
  },
  "catalog": {
    "count": 28
  },
  "top_recommendation": {
    "id": "medagent.nv_segment_ct",
    "path": "skills/nv-segment-ct",
    "kind": "skill",
    "summary": "Engineering-time wrapper around NVIDIA-Medtech NV-Segment-CT (VISTA3D 132-class CT seg foundation model). Invokes the official `HuggingFacePipelineHelper` from https://huggingface.co/nvidia/NV-Segment-CT exactly as the model card recommends.",
    "scope": "development",
    "not_for": [
      "clinical deployment",
      "clinical interpretation",
      "autonomous diagnosis",
      "regulatory submission"
    ],
    "inputs": [
      {
        "name": "ct_volume",
        "type": "file_path",
        "formats": [
          "nifti"
        ]
      }
    ],
    "outputs": [
      {
        "name": "label_map",
        "type": "file_path",
        "formats": [
          "nifti"
        ]
      },
      {
        "name": "result_json",
        "type": "json",
        "formats": []
      }
    ],
    "paired_verifiers": [
      {
        "id": "medagent.verifiers.ct_segmentation_quality_v1",
        "status": "implemented"
      }
    ],
    "requires_gpu": "cuda",
    "requires_docker": false,
    "limitations": [
      "This is a thin wrapper. Inference, preprocessing, and postprocessing are delegated entirely to the official `hugging_face_pipeline.HuggingFacePipelineHelper` in bundle/. Do not modify code under bundle/.",
      "transformers must be a 4.x release; the HF model code uses pre-5.x idioms (e.g. `_tied_weights_keys`).",
      "Device auto-detected (cuda if available, else cpu); `--device` flag overrides."
    ],
    "score": 12,
    "matched_terms": [
      "ct",
      "nifti",
      "segment",
      "volume"
    ],
    "rationale": "matched terms: ct, nifti, segment, volume; inputs: ct_volume(nifti); outputs: label_map, result_json",
    "caveats": [
      "requires GPU: cuda",
      "This is a thin wrapper. Inference, preprocessing, and postprocessing are delegated entirely to the official `hugging_face_pipeline.HuggingFacePipelineHelper` in bundle/. Do not modify code under bundle/.",
      "transformers must be a 4.x release; the HF model code uses pre-5.x idioms (e.g. `_tied_weights_keys`)."
    ]
  },
  "recommendations": [
    {
      "id": "medagent.nv_segment_ct",
      "path": "skills/nv-segment-ct",
      "kind": "skill",
      "summary": "Engineering-time wrapper around NVIDIA-Medtech NV-Segment-CT (VISTA3D 132-class CT seg foundation model). Invokes the official `HuggingFacePipelineHelper` from https://huggingface.co/nvidia/NV-Segment-CT exactly as the model card recommends.",
      "scope": "development",
      "not_for": [
        "clinical deployment",
        "clinical interpretation",
        "autonomous diagnosis",
        "regulatory submission"
      ],
      "inputs": [
        {
          "name": "ct_volume",
          "type": "file_path",
          "formats": [
            "nifti"
          ]
        }
      ],
      "outputs": [
        {
          "name": "label_map",
          "type": "file_path",
          "formats": [
            "nifti"
          ]
        },
        {
          "name": "result_json",
          "type": "json",
          "formats": []
        }
      ],
      "paired_verifiers": [
        {
          "id": "medagent.verifiers.ct_segmentation_quality_v1",
          "status": "implemented"
        }
      ],
      "requires_gpu": "cuda",
      "requires_docker": false,
      "limitations": [
        "This is a thin wrapper. Inference, preprocessing, and postprocessing are delegated entirely to the official `hugging_face_pipeline.HuggingFacePipelineHelper` in bundle/. Do not modify code under bundle/.",
        "transformers must be a 4.x release; the HF model code uses pre-5.x idioms (e.g. `_tied_weights_keys`).",
        "Device auto-detected (cuda if available, else cpu); `--device` flag overrides."
      ],
      "score": 12,
      "matched_terms": [
        "ct",
        "nifti",
        "segment",
        "volume"
      ],
      "rationale": "matched terms: ct, nifti, segment, volume; inputs: ct_volume(nifti); outputs: label_map, result_json",
      "caveats": [
        "requires GPU: cuda",
        "This is a thin wrapper. Inference, preprocessing, and postprocessing are delegated entirely to the official `hugging_face_pipeline.HuggingFacePipelineHelper` in bundle/. Do not modify code under bundle/.",
        "transformers must be a 4.x release; the HF model code uses pre-5.x idioms (e.g. `_tied_weights_keys`)."
      ]
    },
    {
      "id": "medagent.nv_segment_ctmr",
      "path": "skills/nv-segment-ctmr",
      "kind": "skill",
      "summary": "Engineering-time wrapper around NVIDIA-Medtech/NV-Segment-CTMR, a CT/MRI VISTA3D-derived segmentation bundle. Invokes the upstream `python -m monai.bundle run --config_file configs/inference.json` entry point and summarizes the produced NIfTI label map.",
      "scope": "development",
      "not_for": [
        "clinical deployment",
        "clinical interpretation",
        "autonomous diagnosis",
        "regulatory submission"
      ],
      "inputs": [
        {
          "name": "ct_or_mr_volume",
          "type": "file_path",
          "formats": [
            "nifti"
          ]
        }
      ],
      "outputs": [
        {
          "name": "label_map",
          "type": "file_path",
          "formats": [
            "nifti"
          ]
        },
        {
          "name": "result_json",
          "type": "json",
          "formats": []
        }
      ],
      "paired_verifiers": [
        {
          "id": "medagent.verifiers.ct_segmentation_quality_v1",
          "status": "implemented"
        }
      ],
      "requires_gpu": "cuda",
      "requires_docker": false,
      "limitations": [
        "This is a thin wrapper. Inference, preprocessing, and postprocessing are delegated entirely to the upstream MONAI bundle under $NV_SEGMENT_CTMR_ROOT or the repo-local fallback at .workbench_data/upstreams/NV-Segment-CTMR/NV-Segment-CTMR.",
        "The default wrapper path runs automatic \"segment everything\" inference for CT_BODY, MRI_BODY, or MRI_BRAIN. MRI_BRAIN inputs must already follow the upstream brain preprocessing requirements.",
        "Label names are loaded from upstream configs when available. If a label dictionary is absent, the wrapper still records label IDs and marks only negative IDs as invalid."
      ],
      "score": 12,
      "matched_terms": [
        "ct",
        "nifti",
        "segment",
        "volume"
      ],
      "rationale": "matched terms: ct, nifti, segment, volume; inputs: ct_or_mr_volume(nifti); outputs: label_map, result_json",
      "caveats": [
        "requires GPU: cuda",
        "This is a thin wrapper. Inference, preprocessing, and postprocessing are delegated entirely to the upstream MONAI bundle under $NV_SEGMENT_CTMR_ROOT or the repo-local fallback at .workbench_data/upstreams/NV-Segment-CTMR/NV-Segment-CTMR.",
        "The default wrapper path runs automatic \"segment everything\" inference for CT_BODY, MRI_BODY, or MRI_BRAIN. MRI_BRAIN inputs must already follow the upstream brain preprocessing requirements."
      ]
    },
    {
      "id": "medagent.nv_segment_ct_finetune",
      "path": "skills/nv-segment-ct-finetune",
      "kind": "skill",
      "summary": "Auto-configuring wrapper around NVIDIA-Medtech NV-Segment-CT's continual-learning finetune entry. For the MSD Task06 sanity recipe it follows the DFW single-GPU setting: one GPU, fold-0 validation, label mapping `[[1, 23]]`, automatic class-prompt segmentation, patch `[128,128,128]`, 5 epochs, and original-spacing evaluate.json scoring before and after fine-tuning. Anatomy name -> label_mappings is resolved against `bundle/label_dict.json` so the caller never hand-codes the vista3d global index.",
      "scope": "development",
      "not_for": [
        "clinical deployment",
        "clinical interpretation",
        "autonomous diagnosis",
        "regulatory submission",
        "non-CT modalities"
      ],
      "inputs": [
        {
          "name": "dataset_dir",
          "type": "dir_path",
          "formats": []
        },
        {
          "name": "datalist",
          "type": "file_path",
          "formats": [
            "json"
          ]
        },
        {
          "name": "target_anatomy",
          "type": "string",
          "formats": []
        },
        {
          "name": "label_mapping",
          "type": "json",
          "formats": []
        },
        {
          "name": "smoke",
          "type": "bool",
          "formats": []
        },
        {
          "name": "sanity",
          "type": "bool",
          "formats": []
        },
        {
          "name": "auto_seg",
          "type": "bool",
          "formats": []
        },
        {
          "name": "skip_formal_eval",
          "type": "bool",
          "formats": []
        }
      ],
      "outputs": [
        {
          "name": "finetuned_ckpt",
          "type": "file_path",
          "formats": [
            "pytorch"
          ]
        },
        {
          "name": "result_json",
          "type": "json",
          "formats": []
        }
      ],
      "paired_verifiers": [
        {
          "id": "medagent.verifiers.ct_segmentation_finetune_quality_v1",
          "status": "implemented"
        }
      ],
      "requires_gpu": "cuda",
      "requires_docker": false,
      "limitations": [
        "Thin wrapper. Training, validation, transforms, and checkpointing are delegated entirely to the upstream bundle in `bundle/`. Do not modify code under `bundle/`.",
        "The auto-derived plan is a heuristic. Caller-provided `--patch-size`, `--cache-rate`, `--epochs`, `--learning-rate` always win.",